Keywords,Date,Article Title,Grounds,Original Text,Num
Human rights,    28.01.2011 - Interview,Standing Up to Lukashenko-by William Hague and Guido Westerwelle - Federal Foreign Office ,Interview,"Joint contribution by the British Foreign Minister William Hague and Federal Foreign MInister Guido Westerwelle published in the Wall Street Journal, 28.01.2001./////The world has looked on with growing horror as, over the last six weeks, the regime in Belarus has ruthlessly and systematically sought to dismantle the country's civil society and emerging opposition./////The violence on the night of the Dec. 19 presidential election was shocking. But while the attention of the world's media has since turned to focus on other events, the repression in Belarus has continued./////Four presidential candidates and numerous political and civil society activists remain in detention; we have no independent verification of their well-being. Many of them face years in prison on charges of organizing riots, when there is mounting evidence that the election-night violence was staged by the authorities themselves. We have seen curiously stilted recantations delivered by detained opposition activists and broadcast by the state media. We can only speculate as to what prompted them to change their tune overnight./////The regime is also pursuing other means of prosecuting those Belarusians who have dared to raise an independent voice. Every day homes and offices across Belarus are being raided and trashed. More than 200 people have been taken in for interrogation by the Belarusian secret service; this is in addition to the 700 who were arrested on the night of Dec. 19. We hear reports of lawyers being disbarred from practice for speaking up about the abuses to which their clients have been subjected. We are about to see mass expulsions from universities of those students who joined the protests, as happened following the last presidential election in 2006./////There is a serious crisis in the European neighborhood. We must act. At the upcoming European Union Foreign Affairs Council we will call for the EU to reinstate a harsh package of sanctions against Belarus and to consider further measures against Alexander Lukashenko's regime. We cannot turn a blind eye to what is happening today in a fellow European country. President Lukashenko has made his choice and we have no choice but to respond accordingly./////If Belarus turns its back on the world, it will be bad for Belarus. It will damage investor confidence and put it at loggerheads with the path of freedom and justice that the rest of the world prizes./////How did we reach this state of affairs?/////Just over a month ago there was a feeling that Belarus was moving ever so slowly in the right direction. Several candidates had been allowed to stand in the presidential election; they had even been given limited media exposure. Political prisoners had been freed. Tentative overtures had been made to the EU for closer economic ties./////We in the EU were ready to respond, cautiously, with greater engagement in return for continued progress toward international norms. In November, we renewed EU sanctions on Belarus but chose to hold them in suspension pending the conduct of December's election. Then came the night of Dec. 19 and its aftermath, shattering the illusion of tolerance and revealing President Lukashenko's true colors./////We are determined to take action against the Belarusian regime. At the same time, we will not abandon the people of Belarus to their fate. We will continue to support Belarusian civil society, indeed we will step up our efforts. We want the Belarusian people to understand that their fellow Europeans stand with them. And when Belarus chooses to rejoin the wider European community of nations, we will be here waiting, ready and willing to welcome her./////",0.1
Human rights,    28.05.2010 - Press release,Federal Foreign Office promoting the protection of human rights in Iraq - Federal Foreign Office ,dialogue,"The Federal Foreign Office is granting some 61,000 euro of support for the production of ten video podcasts in Arabic focusing on human rights in Iraq. As part of the ""Human Rights Matter"" project organized by the German Institute for Human Rights together with the Goethe-Institut (dialogue point Erbil), ten young Iraqi video jockeys and film makers are in the coming weeks to produce 10-minute video podcasts on various human rights topics, such as minorities or penal matters. The podcasts will then be presented in Iraq and potentially also in other Arab countries via websites, film presentations and seminars./////Given the ongoing difficult human rights situation in Iraq, the project aims to find new ways of anchoring human rights questions more strongly in Iraqi minds. The aim is to make a lasting contribution to strengthening Iraqi civil society./////The project fits into the German Government's many efforts to help bring political and social stability to Iraq. Since 2003, the German Government has donated aid to the tune of 400 million euro. This money is being used to fund numerous projects in the fields of institution-building, further training and human rights.//////////",0.2
Human rights,    06.10.2010 - Speech,Address by Federal Foreign Minister Guido Westerwelle on the presentation of the German Africa Award by the German Africa Foundation - Federal Foreign Office ,Speech,"__ translation of advanced text __//////////Dr Chambas,Professor Hornhues,Dr Eid,Dr Kohler,Professor Driftmann,Ms Schaeffer,Ms Diallo,Excellencies,Ladies and gentlemen,//////////Fifty years ago the world gazed spellbound toward Africa. In 1960, the Year of Africa, no less than 17 countries gained independence. 2010 has in its own way also become a Year of Africa./////South Africa seized the FIFA World Cup as an opportunity for the continent as a whole. This global event single-handedly swept away decades' worth of stereotypes./////Germany had a very similar experience four years earlier./////Everyone in this room knows that Africa is much more than poverty, crisis and disaster. Beyond the walls of this room, however, the fact that many economies in Africa are growing just as fast as in Asia is often still overlooked, as is the fact that an increasing number of international companies are discovering Africa's potential as an investment location, that a new middle class is gradually emerging there. There is good reason why countries such as China are now more present than ever in Africa./////Despite all the challenges, what I see above all when I look at Africa today are major opportunities and untapped potential-economic and political./////African political leaders are taking the continent's fate ever more into their own hands. Regional cooperation is on the rise. The clout of African regional organizations is growing. The principle of ownership is impacting behaviour./////We support these positive developments. We want Africa to rise and prosper./////We cannot solve the world's most pressing problems without our neighbouring continent Africa./////We need a common response to climate change and its consequences, to development and food security issues, and to the challenges posed by rapidly growing or aging populations./////The time has come for a new turn towards partnership in our Africa policy. Away from a donor-recipient outlook. Towards a global responsibility partnership on equal footing./////The German Government will soon present a comprehensive concept for Africa, which takes into account Africa's changed self-perception as well as our own interests./////We see many young faces in the crowd gathered here today. These are the faces of the graduates of the Federal Foreign Office's first Training for International Diplomats course for French-speaking diplomats from Africa. We bid all of you a heartfelt welcome!/////It is up to your generation to create the new image of Africa and to shape future ties between Germany and Africa. Work with us for peace and development, live out our shared values. We can make freedom, democracy, the rule of law and human rights into a reality-in Africa, in Europe, and around the world./////Protecting human rights is an inextricable part of the connection between Europe and Africa. Human rights are the indispensable basis on which Europe and Africa can jointly help shape globalization./////Political rights are equal in importance to social and economic rights. For many years Germany has been calling for the United Nations to recognize the right to water as a human right. It is a great success that the General Assembly joined us in this position in July, and the Human Rights Council last week./////Germany has constantly worked to gain a greater say at the United Nations for the countries of the southern hemisphere./////The world is changing-the geopolitical balance is shifting eastward and southward. Africa is a part of these changes./////This holds especially true of peace and security. A Security Council without a strong African presence no longer reflects the current political reality./////We want to reform the Security Council to ensure that Africa is represented among the permanent members./////Peace and security in Africa will remain a foreign policy priority for Germany. There can be no development without peace and security, as evidenced by the conflicts in Côte d'Ivoire, in the Sudan, in Somalia, and in the Democratic Republic of the Congo./////That's why Germany promotes the multilateral approaches of the United Nations, the European Union and the G8, which aim for a viable African security architecture./////African security structures must grow stronger so that African solutions to African problems can be found. This is what the African Union expects of itself, an expectation which we strongly support./////The Economic Community of West African States has likewise raised its political profile beyond its original economic orientation. Progress in peace and security is all the more precious at a time when resources are scarce in the countries of West Africa. The trend in the region in recent years has been positive. The tireless work of ECOWAS has borne fruit./////I am extraordinarily pleased that Dr Mohamed Ibn Chambas has received this year's German Africa Award./////Dr Chambas, your farsightedness, your courage, your political instincts and your tireless work on behalf of peace and freedom, development and reconciliation have achieved great things in West Africa./////Long before you joined ECOWAS, your reputation as a prudent mediator and conciliator preceded you./////Peaceful settlements in Liberia and Sierra Leone, in Côte d'Ivoire, in Guinea-Bissau and in Togo all bear your mark./////Under your leadership ECOWAS has also worked on solutions to the recent conflicts in Guinea and Niger. We shall miss you very much after your departure from ECOWAS. But I am confident that in other areas you will continue to act with every bit as much determination for the realization of your vision of democracy and the rule of law in West Africa./////It is above all thanks to you that democracy and the rule of law, good governance and human rights are now shared values of all ECOWAS member states./////Security and economic development can succeed only through regional cooperation. This principle has proved its worth in Europe and it is proving its worth in Africa too./////I thank you for your tireless work and unwavering commitment.//////////",0.1
Human rights,    24.03.2010 - Press release,Closer German-Russian cooperation - Federal Foreign Office ,forum,"Andreas Schockenhoff, Member of the German Bundestag, was today confirmed as Coordinator of German-Russian Intersocietal Cooperation by the Federal Cabinet. To mark the occasion, Schockenhoff issued the following statement today (24 March) in Berlin://///""Intersocietal cooperation with Russia is becoming an increasingly important part of overall German-Russian relations. By appointing a ""Russia Coordinator"" the German Government is underlining the significance of people-to-people contacts./////I look forward to continuing and developing this task. My concern is to foster partnerships between towns, cities and districts, exchange and youth programmes, and contacts between NGOs and other private initiatives. These links are the engine on a future-looking close relationship between Germans and Russians./////The modernization agenda with which President Medvedev wants to create a more open Russia brings new tasks for intersocietal cooperation with that country. For this reason I last year formulated 10 theses on German-Russian intersocietal cooperation, which I will refine and implement together with representatives of German and Russian civil society. The aim is modern, project-oriented cooperation./////To that end I will, together with the major German NGOs, set up a ""Civil Society Forum Russia"" in an effort to strengthen the work of the exchange organizations engaged in Russia. On the Russian side, I will continue the collaboration begun in 2009 with the Civil Society Institutions and Human Rights Council and its Chair, Ms Ella Pamfilova. On 17 June 2010 Ms Pamfilova and I will hold a conference in Berlin, and in mid-October there will be a second conference with Russian participants in Moscow./////To enable broader school and youth exchange, I will work towards liberalizing visa requirements. I call on the Russian side to play its part by giving German-Russian youth exchange the necessary political and financial backing./////Intersocietal cooperation with Russia must also be enhanced at EU level. I will therefore, on 6 May, hold an expert round-table discussion on ""EU-Russia-New Prospects for Intersocietal Cooperation"", in which EU Commission, Russian, Polish and French experts will take part./////To mark the 65th anniversary of the end of World War II, on 9 May, I will lay a wreath in a Soviet prisoner of war cemetery in Luckenwalde. This autumn, in St Petersburg, I will take part in a seminar with the ""Memorial"" human rights group on ""remembrance culture"" issues in Western and Eastern Europe""./////",0.1
Human rights,    08.07.2010 - Speech,Speech by Federal Minister Guido Westerwelle in the German Bundestag on freedom of religion - Federal Foreign Office ,Speech,"__ Translation of advance text __/////Mr President, ladies and gentlemen, colleagues,/////An active human rights policy is the trademark of Germany's foreign policy. Promoting freedom of religion is part and parcel of this active human rights policy. I have asked for the floor because I want emphatically to underline that the commitment of the motion's sponsors and, I believe, everyone in this Chamber to freedom of religion and pluralism as well as their rejection of persecution and oppression on religious grounds is something that is not only of great importance to Parliament but is also quite explicitly a core concern of the Federal Government./////We cannot stay silent when millions of Christians worldwide cannot live their faith freely. It is good that this is a matter of concern to us all, irrespective of party affiliation. In many countries the Bible may neither be bought nor read; church services are obstructed; Christians are thrown into jail or sent to labour camps. They may even risk attacks on life and limb. Many countries use prohibitions, the police and punishments to prevent people from practising their faith freely. Often enough they even give their citizens free rein to attack those of other faiths. Either way, freedom of religion is suppressed: through repressive measures and persecution by the state, but also by allowing people to be hounded by the mob and forces hostile to religious tolerance./////It is important to realize-and here we can rely only on estimates by non-governmental organizations-that at least 100 million Christians around the world are currently suffering persecution. But what is at stake here is not just a commitment to the Christian religion, Christian faiths. What is at stake here is something very fundamental. It is our conviction that everyone must be able to practise the faith they themselves perceive as the true faith. Freedom of religion is always also the freedom to practise one's faith freely or to change one's faith. It also involves the right to have no religious belief at all. This is the pluralistic understanding of religious freedom, an understanding we all share not just because it is enshrined in our Basic Law but also because it informs day-to-day political life here in Germany./////Freedom of religion is therefore a right to be enjoyed by members of Christian minorities as well as by adherents of other faiths. When we call for religious freedom for Christians around the world, we must, in the interests of our own credibility, of course first ensure that the state in Germany protects the freedom of everyone in this country to practise their faith whatever their religion. I strongly endorse what Volker Kauder, the CDU/CSU parliamentary group chairperson, has said here in this connection: for us it goes without saying-not just because our constitution obliges us to do so, but because we believe passionately-that just as we insist on religious freedom in other countries, so we should do everything to ensure that freedom of religion is fully respected here in Germany and employ the whole range of instruments of state authority and those of our civil society to that end. This is more than a question of buildings. In reality it is also a question of the climate in our society. Creating the right climate-this, too, is something to which we are all committed./////If Christians just worry about the freedom of Christians, Hindus about the freedom of Hindus, and Muslims about that of Muslims, that is not what we mean by religious coexistence. Different religions can coexist successfully only through mutual respect and dialogue. But let us not deceive ourselves. Here, too, it took centuries-and I am not talking of the Middle Ages-for Europe to develop a set of values that revolve around the individual, values that include the right to practise one's faith freely./////We as Germans should also remember that even in the last century the freedom to practise one's faith in Germany was anything but a matter of course. Millions were murdered on German soil for reasons to do also with their faith. That is why when we call for other countries to respect freedom of religion, we are not preaching to them. When we stand up for religious pluralism everywhere, we are simply taking to heart the lessons of our own history./////Human dignity, freedom, personal responsibility: that is our foundation, one of the great achievements of the European Enlightenment. We stand for a state that respects these values and seek to advance this concept of the state all over the world./////It is crucial, however, that we oppose any attempt to make respect for human rights contingent on cultural factors. One hears so often that we have to be understanding about this or that, it is the product of cultural background, so to speak, or special cultural attributes. That is a kind of watering down of values that we cannot accept. Suppressing religion has nothing to do with culture, it is a negation of culture./////That is the conviction that also informs our policies, it is the conviction which we are all also committed to uphold./////It is often asserted that there is a contradiction between freedom of religion and freedom of expression. We consider it very important to point out time and time again that freedom of expression and freedom of religion are, as it were, both fruits from the same tree, that magnificent great tree of freedom. For that is the whole point. Even if, as a person who thinks, lives and has been brought up religiously, one has the feeling that one's own faith is being disparaged in some way, perhaps by cartoons or other expressions of opinion, that in no way justifies using violence against anyone. Freedom of religion and freedom of expression are by no means incompatible. The truth is that they are a wonderful pair, ladies and gentlemen!/////I would like to close by making a clear commitment on the part of the Federal Government. Anyone who incites inter-religious hatred does so above all for political, not religious reasons. Religion must never serve as a pretext for hatred, as a justification for violence and war. That is why, on behalf of the whole Chamber, I believe, the Federal Government will speak up for this in the international arena, too, by making clear that our commitment to religious freedom is a cornerstone of our human rights policy. The main theme of my speech at the United Nations Human Rights Council in Geneva soon after I took office was freedom of religion, explicitly also the freedom of Christians to practise their faith and profess their beliefs, because I have the impression we must not allow this to be ignored./////With Professor Bielefeldt's appointment a few weeks ago, a German national is now the United Nations Special Rapporteur on Freedom of Religion or Belief. For the task ahead we wish him a sure touch and all success. The goals he is working for are very important to the Federal Government and, I am sure, also to everyone in this Chamber./////If the public sees that we agree on these matters of fundamental values, that is, I believe, a good sign. As a parliamentarian I would like to say finally, with your permission, that this is something that can also be documented in the form of motions we all support./////Thank you very much./////",0.2
Human rights,    30.11.2010 - Speech,"Address by Foreign Minister Westerwelle at the third EU-Africa Summit on 30 November 2010 in Tripoli, Libya - Federal Foreign Office ",Speech,"__ Translation of advanced text __//////////President of the European Council van Rompuy,Colonel Qadhafi,Deputy Chairwoman of the AU,Chairman of the AU Commission Jean Ping,Excellencies,Ladies and gentlemen,//////////I don't want to downplay the major challenges that Africa faces. But what I see above all in Africa are major opportunities. We Europeans want to be equal partners, we want to meet on equal political and economic footing./////The question of how the EU and Africa can provide for more security and peace together is essential to our joint discussion of investment, economic growth and jobs. Prosperity is generated only in security, and lasting security only in a country under the rule of law which protects human rights./////We are all united by the goal of a security structure in Africa which can find African solutions to African problems. Peace and prosperity in Africa are also in the interest of Europe./////I would like to address here three of the many challenges the continent confronts: the Sudan, Somalia and piracy./////A peaceful referendum in the Sudan with fair results would bring increased stability to the whole region. We stand by the Sudan at this defining moment and we shall continue to do so after the referendum. Should the referendum bring about a South Sudanese state, the governments in both the north and the south will need a great deal of support in building up effective structures. Germany is ready to help./////In Somalia we have combined humanitarian aid with assistance in political reconstruction. Both bilaterally and in the EU, Germany supports the transitional government and the African Union Mission in Somalia. Of course, we cannot redress the consequences of a collapsed state on our own through EU missions to train Somali security forces or through our support for the rebuilding of the justice system. Peace can only succeed if the conflicting parties within Somalia make a serious effort to reach a peaceful solution. Because only a fair and stable social order can prevent instability and violence, we will use our networked approach to support Somalia on its path towards internal reconciliation./////The protection of humanitarian aid for Somalia is also our foremost aim in combating piracy off the coast of Somalia. Piracy threatens the women, men and children not only of Somalia, but of all of eastern Africa. It is in the shared interest of Africa and the EU for trade to remain possible in the region. Warships can only be a small part of a comprehensive solution. What the people of Somalia need first and foremost are prospects for the future./////The example of piracy shows the increase in global challenges in which Africa's interests run parallel to those of the EU. Such challenges-from piracy to fair development, from protecting human rights to combating climate change-require patience. But we must not waste any time. Ignoring problems does not make them go away./////We as the EU can achieve a great deal by working together with the AU and other regional organizations. Worldwide problems must be tackled within the United Nations. We will always be there to listen to your concerns and to support your goals in every way possible./////The Security Council cannot neglect the changes that have occurred in the past 65 years. The growing influence of Africa must be reflected in the composition of the Security Council./////Germany has supported the African Union in many ways in the past. The building of the headquarters for the AU Department of Peace and Security is only one example here. We will continue to support you.//////////",0.1
